{
  "$schema": "../../reference/definition.schema.json",
  "schemaVersion": 1,
  "title": "Slime Intro",
  "source": {
    "file": "../files/01-slime-intro.gh",
    "sha256": "7166dd8614bdcd6a317ac1d9eed08a2f8bd82e2c1e5615d454ff087978daa54e",
    "documentId": "014084e4-ea51-4fb6-8b8f-2d10c8914d28"
  },
  "extraction": {
    "method": "GH_IO archive read without loading components or solving",
    "coverage": "All saved top-level objects and Source wires; not an executable replacement for the .gh file",
    "limitations": [
      "Binary geometry and image payloads are omitted and identified by archive XML hashes.",
      "External files and Rhino document geometry are not bundled. Inspect saved paths and references.",
      "Runtime outputs, nested cluster internals and plugin-specific behavior are not reconstructed.",
      "Saved library versions describe the archive, not a guarantee of compatibility with newer components."
    ],
    "omittedBinaryPaths": [],
    "unresolvedGroupMembers": [
      {
        "groupId": "042bab6e-7f62-41c7-857e-ba559bf4c14d",
        "memberId": "8556110e-65cb-45d8-8f8e-df992fd08398"
      },
      {
        "groupId": "042bab6e-7f62-41c7-857e-ba559bf4c14d",
        "memberId": "bc7cc803-8295-4f3b-a832-39169eb93427"
      },
      {
        "groupId": "042bab6e-7f62-41c7-857e-ba559bf4c14d",
        "memberId": "ff4ca24e-df15-4e88-ae0e-ecd129da2cb6"
      },
      {
        "groupId": "042bab6e-7f62-41c7-857e-ba559bf4c14d",
        "memberId": "53a0c2d2-2ff9-4c1e-8901-37df0857d199"
      },
      {
        "groupId": "042bab6e-7f62-41c7-857e-ba559bf4c14d",
        "memberId": "7cc78014-29cb-4d05-8d69-3d78b9425d2e"
      },
      {
        "groupId": "042bab6e-7f62-41c7-857e-ba559bf4c14d",
        "memberId": "a21a7462-ef0d-49de-880c-cf3895e4c435"
      },
      {
        "groupId": "e54d32b5-2035-4709-9fcc-d2c06fda826f",
        "memberId": "2378d602-76a0-4f40-b308-76534908e36f"
      },
      {
        "groupId": "e54d32b5-2035-4709-9fcc-d2c06fda826f",
        "memberId": "6e7d0e3a-8904-43cc-b06e-be6bc4bf0a15"
      },
      {
        "groupId": "d3802ee2-1074-4715-8dfc-282053c5e13b",
        "memberId": "659075c6-0bff-4e87-875c-6b9e27f45268"
      },
      {
        "groupId": "d3802ee2-1074-4715-8dfc-282053c5e13b",
        "memberId": "ea8ca145-08c3-4a46-a6b4-0f43a5b3dbfb"
      },
      {
        "groupId": "52c1cbc1-37ef-4053-8547-c87eb55de275",
        "memberId": "57bd719d-177d-4272-91f1-92a5305c1626"
      },
      {
        "groupId": "39aaa0e2-df1a-45f2-b9da-e94bfcd24ec4",
        "memberId": "8a28dff1-8666-4e22-8aa8-f6f3e4c8fd9a"
      },
      {
        "groupId": "542d2a07-6ffa-4c71-8856-f21f1cd37dc1",
        "memberId": "d08536e2-9eeb-4860-b9bf-4e03cedd3b51"
      },
      {
        "groupId": "960f9eae-0913-4cc5-8f66-3b0c093aa17d",
        "memberId": "803219f4-1514-4359-9b4e-ca02f1a373e8"
      },
      {
        "groupId": "1bf186d4-3066-480f-adf4-f451c4c8416a",
        "memberId": "a0535faf-3fb5-42fe-9409-c4e732fa9d83"
      },
      {
        "groupId": "326c7f50-6821-4950-82fd-ce8fa14a6ac3",
        "memberId": "3595d71b-1733-4d54-a50f-85da0a949fde"
      },
      {
        "groupId": "326c7f50-6821-4950-82fd-ce8fa14a6ac3",
        "memberId": "33e66867-d0f7-4ed6-bf2e-05a5d47be5ba"
      },
      {
        "groupId": "326c7f50-6821-4950-82fd-ce8fa14a6ac3",
        "memberId": "3c34396b-f62a-4c86-92ff-92cd93c44497"
      },
      {
        "groupId": "326c7f50-6821-4950-82fd-ce8fa14a6ac3",
        "memberId": "2a78054a-4d37-4bdb-bb20-0e0b8ecd25cd"
      },
      {
        "groupId": "326c7f50-6821-4950-82fd-ce8fa14a6ac3",
        "memberId": "6f811524-edd2-492a-a342-170f2d4863c0"
      },
      {
        "groupId": "326c7f50-6821-4950-82fd-ce8fa14a6ac3",
        "memberId": "729cb0ee-a652-4d9b-a126-8f4a70098555"
      },
      {
        "groupId": "326c7f50-6821-4950-82fd-ce8fa14a6ac3",
        "memberId": "9d5ce7c9-4a6a-4878-999e-7da03d25094f"
      },
      {
        "groupId": "326c7f50-6821-4950-82fd-ce8fa14a6ac3",
        "memberId": "3a078fb8-b274-420e-b89b-ab10e90e1777"
      }
    ]
  },
  "libraries": [
    {
      "name": "Library",
      "items": [
        {
          "name": "Author",
          "type": "gh_string",
          "value": "Robert McNeel & Associates"
        },
        {
          "name": "Id",
          "type": "gh_guid",
          "value": "00000000-0000-0000-0000-000000000000"
        },
        {
          "name": "Name",
          "type": "gh_string",
          "value": "Grasshopper"
        },
        {
          "name": "Version",
          "type": "gh_string",
          "value": "9.0.26244.12303"
        }
      ],
      "chunks": [],
      "index": 0
    },
    {
      "name": "Library",
      "items": [
        {
          "name": "AssemblyFullName",
          "type": "gh_string",
          "value": "Nuclei4, Version=4.1.0.0, Culture=neutral, PublicKeyToken=null"
        },
        {
          "name": "AssemblyVersion",
          "type": "gh_string",
          "value": "4.1.0.0"
        },
        {
          "name": "Author",
          "type": "gh_string",
          "value": "Madalin Gheorghe"
        },
        {
          "name": "Id",
          "type": "gh_guid",
          "value": "a4810f34-10b6-480c-a6d0-607aac4e8d2a"
        },
        {
          "name": "Name",
          "type": "gh_string",
          "value": "Nuclei4"
        },
        {
          "name": "Version",
          "type": "gh_string",
          "value": ""
        }
      ],
      "chunks": [],
      "index": 1
    }
  ],
  "nodes": [
    {
      "id": "042bab6e-7f62-41c7-857e-ba559bf4c14d",
      "componentGuid": "c552a431-af5b-46a9-a8a4-0fcbc27ef596",
      "name": "Group",
      "nickname": "",
      "libraryId": null,
      "inputs": [],
      "outputs": [],
      "savedState": {
        "name": "Container",
        "items": [
          {
            "name": "Border",
            "type": "gh_int32",
            "value": "1"
          },
          {
            "name": "Colour",
            "type": "gh_drawing_color",
            "xmlValue": "<item name=\"Colour\" type_name=\"gh_drawing_color\" type_code=\"36\">\n                      <ARGB>75;234;0;255</ARGB>\n                    </item>"
          },
          {
            "name": "Description",
            "type": "gh_string",
            "value": "A group of Grasshopper objects"
          },
          {
            "name": "ID",
            "type": "gh_guid",
            "index": 0,
            "value": "8556110e-65cb-45d8-8f8e-df992fd08398"
          },
          {
            "name": "ID",
            "type": "gh_guid",
            "index": 1,
            "value": "bc7cc803-8295-4f3b-a832-39169eb93427"
          },
          {
            "name": "ID",
            "type": "gh_guid",
            "index": 2,
            "value": "ff4ca24e-df15-4e88-ae0e-ecd129da2cb6"
          },
          {
            "name": "ID",
            "type": "gh_guid",
            "index": 3,
            "value": "53a0c2d2-2ff9-4c1e-8901-37df0857d199"
          },
          {
            "name": "ID",
            "type": "gh_guid",
            "index": 4,
            "value": "7cc78014-29cb-4d05-8d69-3d78b9425d2e"
          },
          {
            "name": "ID",
            "type": "gh_guid",
            "index": 5,
            "value": "a21a7462-ef0d-49de-880c-cf3895e4c435"
          },
          {
            "name": "ID_Count",
            "type": "gh_int32",
            "value": "6"
          },
          {
            "name": "InstanceGuid",
            "type": "gh_guid",
            "value": "042bab6e-7f62-41c7-857e-ba559bf4c14d"
          },
          {
            "name": "Name",
            "type": "gh_string",
            "value": "Group"
          },
          {
            "name": "NickName",
            "type": "gh_string",
            "value": ""
          }
        ],
        "chunks": []
      },
      "canvas": {
        "name": "Attributes",
        "items": [],
        "chunks": []
      },
      "groupMembers": [
        "8556110e-65cb-45d8-8f8e-df992fd08398",
        "bc7cc803-8295-4f3b-a832-39169eb93427",
        "ff4ca24e-df15-4e88-ae0e-ecd129da2cb6",
        "53a0c2d2-2ff9-4c1e-8901-37df0857d199",
        "7cc78014-29cb-4d05-8d69-3d78b9425d2e",
        "a21a7462-ef0d-49de-880c-cf3895e4c435"
      ]
    },
    {
      "id": "e54d32b5-2035-4709-9fcc-d2c06fda826f",
      "componentGuid": "c552a431-af5b-46a9-a8a4-0fcbc27ef596",
      "name": "Group",
      "nickname": "",
      "libraryId": null,
      "inputs": [],
      "outputs": [],
      "savedState": {
        "name": "Container",
        "items": [
          {
            "name": "Border",
            "type": "gh_int32",
            "value": "1"
          },
          {
            "name": "Colour",
            "type": "gh_drawing_color",
            "xmlValue": "<item name=\"Colour\" type_name=\"gh_drawing_color\" type_code=\"36\">\n                      <ARGB>75;221;255;0</ARGB>\n                    </item>"
          },
          {
            "name": "Description",
            "type": "gh_string",
            "value": "A group of Grasshopper objects"
          },
          {
            "name": "ID",
            "type": "gh_guid",
            "index": 0,
            "value": "2378d602-76a0-4f40-b308-76534908e36f"
          },
          {
            "name": "ID",
            "type": "gh_guid",
            "index": 1,
            "value": "6e7d0e3a-8904-43cc-b06e-be6bc4bf0a15"
          },
          {
            "name": "ID",
            "type": "gh_guid",
            "index": 2,
            "value": "8568bf0c-38c9-4a7e-ae7f-88efa3ae3f86"
          },
          {
            "name": "ID",
            "type": "gh_guid",
            "index": 3,
            "value": "83e98b8b-3a0b-4ff7-aac6-3c9d58ed329a"
          },
          {
            "name": "ID",
            "type": "gh_guid",
            "index": 4,